[
  {
    "id": "speaker_oikawa",
    "name": "及川拓也",
    "icon_url": "",
    "job": "",
    "bio": "及川拓也は、Web技術の進化とキャリア形成に関する専門家です。",
    "twitter_handle": "oikawa"
  },
  {
    "id": "speaker_nakamura",
    "name": "なかむらさとる",
    "icon_url": "",
    "job": "",
    "bio": "なかむらさとるは、BigQueryの専門家です。",
    "twitter_handle": "nakamura"
  },
  {
    "id": "speaker_yakura",
    "name": "Yakura",
    "icon_url": "",
    "job": "",
    "bio": "Yakuraは、Webアプリのデバッグ技術に関する専門家です。",
    "twitter_handle": "yakura"
  },
  {
    "id": "speaker_andho",
    "name": "Andho",
    "icon_url": "",
    "job": "",
    "bio": "AndhoはGoogle Mapsのエキスパートです.",
    "twitter_handle": ""
  },
  {
    "id": "speaker_takahirom",
    "name": "Takahirom",
    "icon_url": "",
    "job": "",
    "bio": "TakahiromはKMPのエキスパートです.",
    "twitter_handle": ""
  },
  {
    "id": "speaker_fukushima",
    "name": "福島ゆかり",
    "icon_url": "",
    "job": "",
    "bio": "福島ゆかりはGoogleのテクノロジーのエキスパートです.",
    "twitter_handle": ""
  },
  {
    "id": "speaker_yoichiro",
    "name": "Yoichiro",
    "icon_url": "",
    "job": "",
    "bio": "YoichiroはGen AIのエキスパートです.",
    "twitter_handle": ""
  },
  {
    "id": "speaker_kaz",
    "name": "Kaz",
    "icon_url": "",
    "job": "",
    "bio": "KazはADKのエキスパートです.",
    "twitter_handle": ""
  },
  {
    "id": "speaker_tanabee",
    "name": "tanabee",
    "icon_url": "",
    "job": "",
    "bio": "tanabeeはFirebaseのエキスパートです.",
    "twitter_handle": ""
  },
  {
    "id": "speaker_saku",
    "icon_url": "",
    "job": "",
    "bio": "SakuはWeb/Angularのエキスパートです.",
    "twitter_handle": ""
  },
  {
    "id": "speaker_bankushi",
    "name": "ばんくし",
    "icon_url": "",
    "job": "",
    "bio": "ばんくしはAIツールのエキスパートです.",
    "twitter_handle": ""
  },
  {
    "id": "speaker_ozaki",
    "name": "Ozaki",
    "icon_url": "",
    "job": "",
    "bio": "Ozakiはデータ分析のエキスパートです.",
    "twitter_handle": ""
  },
  {
    "id": "speaker_gemma",
    "name": "Gemma Expert",
    "icon_url": "",
    "job": "",
    "bio": "Gemmaのエキスパートです.",
    "twitter_handle": ""
  },
  {
    "id": "speaker_yanzm",
    "icon_url": "",
    "job": "",
    "bio": "yanzmはAndroid/Flutterのエキスパートです.",
    "twitter_handle": ""
  },
  {
    "id": "speaker_shoco",
    "name": "Shoco",
    "icon_url": "",
    "job": "",
    "bio": "ShocoはWTMのキャリアパネルのエキスパートです.",
    "twitter_handle": ""
  },
  {
    "id": "speaker_community_ja",
    "name": "Community Speaker JA",
    "icon_url": "",
    "job": "",
    "bio": "コミュニティスピーカーです.",
    "twitter_handle": ""
  },
  {
    "id": "speaker_community_en",
    "name": "Community Speaker EN",
    "icon_url": "",
    "job": "",
    "bio": "Community Speaker ENです.",
    "twitter_handle": ""
  },
  {
    "id": "speaker_saku_d",
    "name": "Saku",
    "icon_url": "",
    "job": "",
    "bio": "SakuはWeb/Angularのエキスパートです.",
    "twitter_handle": ""
  }
]
